STARTING CPU EXPERIMENTS
🔵🔵🔵🔵🔵🔵🔵🔵🔵🔵🔵🔵🔵🔵🔵🔵🔵🔵🔵🔵🔵🔵🔵🔵🔵🔵🔵🔵🔵🔵🔵🔵🔵🔵🔵🔵🔵🔵🔵🔵

================================================================================
Training resnet18 | Batch=16 | Opt=SGD | LR=0.001
================================================================================
💡 FLOPs: 37.22 MFLOPs

Epoch 1/10
Train Loss: 0.5277, Train Acc: 81.06%                                                 
Val Loss: 0.3543, Val Acc: 86.62%

Epoch 2/10
Train Loss: 0.3483, Train Acc: 87.27%                                                 
Val Loss: 0.3315, Val Acc: 87.25%

Epoch 3/10
Train Loss: 0.2959, Train Acc: 89.04%                                                 
Val Loss: 0.3079, Val Acc: 88.63%

Epoch 4/10
Train Loss: 0.2627, Train Acc: 90.36%                                                 
Val Loss: 0.2877, Val Acc: 89.72%

Epoch 5/10
Train Loss: 0.2365, Train Acc: 91.24%                                                 
Val Loss: 0.2674, Val Acc: 90.62%

Epoch 6/10
Train Loss: 0.2151, Train Acc: 91.98%                                                 
Val Loss: 0.2630, Val Acc: 90.47%

Epoch 7/10
Train Loss: 0.1959, Train Acc: 92.55%                                                 
Val Loss: 0.2804, Val Acc: 90.03%

Epoch 8/10
Train Loss: 0.1821, Train Acc: 93.30%                                                 
Val Loss: 0.2685, Val Acc: 90.53%

Epoch 9/10
Train Loss: 0.1671, Train Acc: 93.81%                                                 
Val Loss: 0.2964, Val Acc: 89.63%

Epoch 10/10
Train Loss: 0.1555, Train Acc: 94.25%                                                 
Val Loss: 0.2720, Val Acc: 90.40%
                                                           
✅ Test Accuracy: 90.50%
️  Training Time: 834882.60 ms (834.88 sec)
📊 Graph saved: graphs_cpu/resnet18_bs16_SGD_lr0.001.png

================================================================================
Training resnet50 | Batch=16 | Opt=SGD | LR=0.001
================================================================================
💡 FLOPs: 84.34 MFLOPs

Epoch 1/10
Train Loss: 0.9221, Train Acc: 70.55%                                                 
Val Loss: 0.5352, Val Acc: 80.98%

Epoch 2/10
Train Loss: 0.5215, Train Acc: 81.74%                                                 
Val Loss: 0.4480, Val Acc: 83.63%

Epoch 3/10
Train Loss: 0.4247, Train Acc: 84.59%                                                 
Val Loss: 0.3666, Val Acc: 86.13%

Epoch 4/10
Train Loss: 0.3599, Train Acc: 86.67%                                                 
Val Loss: 0.3437, Val Acc: 87.27%

Epoch 5/10
Train Loss: 0.3351, Train Acc: 87.59%                                                 
Val Loss: 0.3524, Val Acc: 87.23%

Epoch 6/10
Train Loss: 0.3157, Train Acc: 88.40%                                                 
Val Loss: 0.3034, Val Acc: 88.62%

Epoch 7/10
Train Loss: 0.2838, Train Acc: 89.51%                                                 
Val Loss: 0.2952, Val Acc: 88.82%

Epoch 8/10
Train Loss: 0.2637, Train Acc: 90.00%                                                 
Val Loss: 0.3108, Val Acc: 88.33%

Epoch 9/10
Train Loss: 0.2434, Train Acc: 90.80%                                                 
Val Loss: 0.3158, Val Acc: 88.57%

Epoch 10/10
Train Loss: 0.2257, Train Acc: 91.46%                                                 
Val Loss: 0.2981, Val Acc: 89.28%
                                                          
✅ Test Accuracy: 89.09%
️  Training Time: 1994688.69 ms (1994.69 sec)
📊 Graph saved: graphs_cpu/resnet50_bs16_SGD_lr0.001.png

================================================================================
Training resnet18 | Batch=16 | Opt=Adam | LR=0.001
================================================================================
💡 FLOPs: 37.22 MFLOPs

Epoch 1/10
Train Loss: 0.5331, Train Acc: 81.34%                                                 
Val Loss: 0.3990, Val Acc: 85.70%

Epoch 2/10
Train Loss: 0.3740, Train Acc: 86.33%                                                 
Val Loss: 0.3330, Val Acc: 87.50%

Epoch 3/10
Train Loss: 0.3311, Train Acc: 88.14%                                                 
Val Loss: 0.3066, Val Acc: 89.28%

Epoch 4/10
Train Loss: 0.2895, Train Acc: 89.50%                                                 
Val Loss: 0.2964, Val Acc: 88.55%

Epoch 5/10
Train Loss: 0.2597, Train Acc: 90.52%                                                  
Val Loss: 0.3039, Val Acc: 88.75%

Epoch 6/10
Train Loss: 0.2376, Train Acc: 91.25%                                                 
Val Loss: 0.2618, Val Acc: 90.67%

Epoch 7/10
Train Loss: 0.2179, Train Acc: 92.07%                                                 
Val Loss: 0.2617, Val Acc: 90.40%

Epoch 8/10
Train Loss: 0.1995, Train Acc: 92.57%                                                 
Val Loss: 0.2667, Val Acc: 90.18%

Epoch 9/10
Train Loss: 0.1834, Train Acc: 93.15%                                                 
Val Loss: 0.2582, Val Acc: 90.82%

Epoch 10/10
Train Loss: 0.1651, Train Acc: 93.84%                                                 
Val Loss: 0.2614, Val Acc: 90.48%
                                                           
✅ Test Accuracy: 90.09%
️  Training Time: 1106555.34 ms (1106.56 sec)
📊 Graph saved: graphs_cpu/resnet18_bs16_Adam_lr0.001.png

================================================================================
Training resnet50 | Batch=16 | Opt=Adam | LR=0.001
================================================================================
💡 FLOPs: 84.34 MFLOPs

Epoch 1/10
Train Loss: 0.9526, Train Acc: 71.63%                                                 
Val Loss: 0.6007, Val Acc: 78.40%

Epoch 2/10
Train Loss: 0.6824, Train Acc: 78.36%                                                 
Val Loss: 1.4051, Val Acc: 67.47%

Epoch 3/10
Train Loss: 0.5541, Train Acc: 81.29%                                                 
Val Loss: 0.3917, Val Acc: 85.13%

Epoch 4/10
Train Loss: 0.4682, Train Acc: 83.72%                                                 
Val Loss: 0.3718, Val Acc: 86.80%

Epoch 5/10
Train Loss: 0.4391, Train Acc: 84.59%                                                 
Val Loss: 0.3787, Val Acc: 85.33%

Epoch 6/10
Train Loss: 0.3890, Train Acc: 86.23%                                                 
Val Loss: 0.3531, Val Acc: 86.75%

Epoch 7/10
Train Loss: 0.3652, Train Acc: 87.10%                                                 
Val Loss: 0.3130, Val Acc: 88.23%

Epoch 8/10
Train Loss: 0.3395, Train Acc: 88.32%                                                 
Val Loss: 0.3055, Val Acc: 88.65%

Epoch 9/10
Train Loss: 0.3034, Train Acc: 89.01%                                                 
Val Loss: 0.3068, Val Acc: 88.70%

Epoch 10/10
Train Loss: 0.2798, Train Acc: 90.00%                                                 
Val Loss: 0.2964, Val Acc: 89.17%
                                                          
✅ Test Accuracy: 88.91%
️  Training Time: 2276443.92 ms (2276.44 sec)
📊 Graph saved: graphs_cpu/resnet50_bs16_Adam_lr0.001.png

================================================================================
SAVING BEST MODELS ONLY
================================================================================

 Best RESNET18 Saved:
   File: best_resnet18_CPU_bs16_SGD_lr0.001_acc90.50.pth
   Accuracy: 90.50%
   Config: Batch=16, Opt=SGD, LR=0.001

 Best RESNET50 Saved:
   File: best_resnet50_CPU_bs16_SGD_lr0.001_acc89.09.pth
   Accuracy: 89.09%
   Config: Batch=16, Opt=SGD, LR=0.001

================================================================================
CPU RESULTS
================================================================================
Compute  Batch Size Optimizer  Learning Rate  ResNet-18 Acc  ResNet-18 Time  ResNet-18 FLOPs  ResNet-50 Acc  ResNet-50 Time  ResNet-50 FLOPs
    CPU          16       SGD          0.001          90.50       834882.60            37.22          89.09      1994688.69            84.34
    CPU          16      Adam          0.001          90.09      1106555.34            37.22          88.91      2276443.92            84.34

💾 Results: results_cpu/fashionmnist_cpu_results.csv
💾 Graphs: graphs_cpu/
💾 Best Models (2 only): best_cpu_models/

================================================================================
✅ CPU EXPERIMENTS COMPLETED - SAVED ONLY 2 BEST MODELS
================================================================================